Category,Question,"Question Image","Explanation Image",Explanation,"Option 1","Option 2","Option 3","Option 4",Answer
"LO2: 2.1: Define the criteria for checking that plans are current","What must the asset owner do when information is requested about buried services in a proposed work area by an enquirer?",https://d2ywuokkaz628s.cloudfront.net/training_course/175/submodules/n7LTH4VSyg3C7ulefTQGlIfGcruLM8V2mcANXcNR.jpg,https://d2ywuokkaz628s.cloudfront.net/training_course/175/submodules/n7LTH4VSyg3C7ulefTQGlIfGcruLM8V2mcANXcNR.jpg,n/a,"Refer enquirers to the relevant webpage where plans can be downloaded","Provide enquirers with up to date information for the proposed work area with 30 days","Provide enquirers with up to date, readable plans for the proposed work area","Refer enquirers to a specialist who will survey the area for a reasonable charge",3
"LO2: 2.1: Define the criteria for checking that plans are current","Who is responsible for providing enquirers with up to date, readable plans of all known services buried in the proposed work area?",https://d2ywuokkaz628s.cloudfront.net/training_course/175/submodules/n7LTH4VSyg3C7ulefTQGlIfGcruLM8V2mcANXcNR.jpg,https://d2ywuokkaz628s.cloudfront.net/training_course/175/submodules/n7LTH4VSyg3C7ulefTQGlIfGcruLM8V2mcANXcNR.jpg,n/a,"The CDM coordinator","The principle contractor","The asset owner","The local authority",3
"LO2: 2.1: Define the criteria for checking that plans are current","Why must the date of issue be checked when receiving plans?",https://d2ywuokkaz628s.cloudfront.net/training_course/175/submodules/n7LTH4VSyg3C7ulefTQGlIfGcruLM8V2mcANXcNR.jpg,https://d2ywuokkaz628s.cloudfront.net/training_course/175/submodules/n7LTH4VSyg3C7ulefTQGlIfGcruLM8V2mcANXcNR.jpg,n/a,"To ensure plans are authentic","To ensure plans are current","To ensure plans are reliable","To ensure plans are readable",2
"LO2: 2.1: Define the criteria for checking that plans are current","What information should be checked to ensure plans are current?",https://d2ywuokkaz628s.cloudfront.net/training_course/175/submodules/n7LTH4VSyg3C7ulefTQGlIfGcruLM8V2mcANXcNR.jpg,https://d2ywuokkaz628s.cloudfront.net/training_course/175/submodules/n7LTH4VSyg3C7ulefTQGlIfGcruLM8V2mcANXcNR.jpg,n/a,Scale,"Date of issue","Grid reference","Printed in colour",2
"LO2: 2.4: Define the importance of marking the site clearly prior to excavation","Why must the location of services be marked clearly prior to excavation?",https://d2ywuokkaz628s.cloudfront.net/training_course/175/submodules/n7LTH4VSyg3C7ulefTQGlIfGcruLM8V2mcANXcNR.jpg,https://d2ywuokkaz628s.cloudfront.net/training_course/175/submodules/n7LTH4VSyg3C7ulefTQGlIfGcruLM8V2mcANXcNR.jpg,n/a,"To reduce the risk of damage to the service","To prove that a survey has taken place","To plan the location of new services","To prevent the need of costly trial holes",1
"LO2: 2.4: Define the importance of marking the site clearly prior to excavation","What action should be taken to reduce the risk of damage to underground services following a successful site survey using a detection devices on a grass verge?",https://d2ywuokkaz628s.cloudfront.net/training_course/175/submodules/n7LTH4VSyg3C7ulefTQGlIfGcruLM8V2mcANXcNR.jpg,https://d2ywuokkaz628s.cloudfront.net/training_course/175/submodules/n7LTH4VSyg3C7ulefTQGlIfGcruLM8V2mcANXcNR.jpg,n/a,"Use steel pins to mark the location of services","Start excavation activities immediately","Update plans and drawings to ensure they remain current","Mark the location of services using wooden pegs",4
"LO2: 2.4: Define the importance of marking the site clearly prior to excavation","What action should be taken to reduce the risk of damage to underground services following a successful survey of the site using a detection devices?",https://d2ywuokkaz628s.cloudfront.net/training_course/175/submodules/n7LTH4VSyg3C7ulefTQGlIfGcruLM8V2mcANXcNR.jpg,https://d2ywuokkaz628s.cloudfront.net/training_course/175/submodules/n7LTH4VSyg3C7ulefTQGlIfGcruLM8V2mcANXcNR.jpg,n/a,"Start excavation activities immediately","Take pictures of the location","Mark the position of the service","Update plans and drawings",3
"LO2: 2.4: Define the importance of marking the site clearly prior to excavation","What is the purpose of marking the location of services following a successful survey of the site using a detection device?",https://d2ywuokkaz628s.cloudfront.net/training_course/175/submodules/n7LTH4VSyg3C7ulefTQGlIfGcruLM8V2mcANXcNR.jpg,https://d2ywuokkaz628s.cloudfront.net/training_course/175/submodules/n7LTH4VSyg3C7ulefTQGlIfGcruLM8V2mcANXcNR.jpg,n/a,"To avoid digging trial holes to identify services","To verify the depth of the service","To reduce the risk of damage to the service","To update service plans and other documentation",3
"LO2: 2.4: Define the importance of marking the site clearly prior to excavation","What is the most likely consequence to members of the public following damage to an underground service that has not been marked?",https://d2ywuokkaz628s.cloudfront.net/training_course/175/submodules/n7LTH4VSyg3C7ulefTQGlIfGcruLM8V2mcANXcNR.jpg,https://d2ywuokkaz628s.cloudfront.net/training_course/175/submodules/n7LTH4VSyg3C7ulefTQGlIfGcruLM8V2mcANXcNR.jpg,n/a,"Severe or fatal injuries","Additional costs due to time consuming repairs","Required to pay fines and penalties","Inconvenience caused by disruption to service",4
"LO2: 2.4: Define the importance of marking the site clearly prior to excavation","Why must services be traced and marked throughout the full extent of the site?",https://d2ywuokkaz628s.cloudfront.net/training_course/175/submodules/n7LTH4VSyg3C7ulefTQGlIfGcruLM8V2mcANXcNR.jpg,https://d2ywuokkaz628s.cloudfront.net/training_course/175/submodules/n7LTH4VSyg3C7ulefTQGlIfGcruLM8V2mcANXcNR.jpg,n/a,"To note the line of services as they change direction","To identify the most appropriate location to excavate","To determine if the worksite is congested","To determine if services are shallow",1
"LO4: 4.2: Identify the distinguishing characteristics of underground utilities apparatus and highway","What is the colour of a low pressure polyethylene (PE) gas service?",https://d2ywuokkaz628s.cloudfront.net/training_course/175/submodules/n7LTH4VSyg3C7ulefTQGlIfGcruLM8V2mcANXcNR.jpg,https://d2ywuokkaz628s.cloudfront.net/training_course/175/submodules/n7LTH4VSyg3C7ulefTQGlIfGcruLM8V2mcANXcNR.jpg,n/a,Blue,Green,Yellow,Orange,3
"LO4: 4.2: Identify the distinguishing characteristics of underground utilities apparatus and highway","What service would typically be constructed using blue polyethylene pipe?",https://d2ywuokkaz628s.cloudfront.net/training_course/175/submodules/n7LTH4VSyg3C7ulefTQGlIfGcruLM8V2mcANXcNR.jpg,https://d2ywuokkaz628s.cloudfront.net/training_course/175/submodules/n7LTH4VSyg3C7ulefTQGlIfGcruLM8V2mcANXcNR.jpg,n/a,Flexible,Electricity,Water,Telecommunications,3
"LO4: 4.2: Identify the distinguishing characteristics of underground utilities apparatus and highway","What colour are low voltage electricity cables?",https://d2ywuokkaz628s.cloudfront.net/training_course/175/submodules/n7LTH4VSyg3C7ulefTQGlIfGcruLM8V2mcANXcNR.jpg,https://d2ywuokkaz628s.cloudfront.net/training_course/175/submodules/n7LTH4VSyg3C7ulefTQGlIfGcruLM8V2mcANXcNR.jpg,n/a,Red,Yellow,Black,Green,3
"LO4: 4.2: Identify the distinguishing characteristics of underground utilities apparatus and highway","What is the colour of the water service?",https://d2ywuokkaz628s.cloudfront.net/training_course/175/submodules/n7LTH4VSyg3C7ulefTQGlIfGcruLM8V2mcANXcNR.jpg,https://d2ywuokkaz628s.cloudfront.net/training_course/175/submodules/n7LTH4VSyg3C7ulefTQGlIfGcruLM8V2mcANXcNR.jpg,n/a,Yellow,Green,Red,Blue,4
"LO4: 4.2: Identify the distinguishing characteristics of underground utilities apparatus and highway","Which of the following services would be made from a blue pipe marked with brown stripes?",https://d2ywuokkaz628s.cloudfront.net/training_course/175/submodules/n7LTH4VSyg3C7ulefTQGlIfGcruLM8V2mcANXcNR.jpg,https://d2ywuokkaz628s.cloudfront.net/training_course/175/submodules/n7LTH4VSyg3C7ulefTQGlIfGcruLM8V2mcANXcNR.jpg,n/a,"Non-potable water",Sewerage,"Water in contaminated ground","Fire fighting",3
"LO4: 4.2: Identify the distinguishing characteristics of underground utilities apparatus and highway","Which of the following services can be constructed using an earthenware pipe?",https://d2ywuokkaz628s.cloudfront.net/training_course/175/submodules/n7LTH4VSyg3C7ulefTQGlIfGcruLM8V2mcANXcNR.jpg,https://d2ywuokkaz628s.cloudfront.net/training_course/175/submodules/n7LTH4VSyg3C7ulefTQGlIfGcruLM8V2mcANXcNR.jpg,n/a,"Surface water drainage","Cable television","Non-potable water","Oil or fuel pipelines",1
"LO4: 4.2: Identify the distinguishing characteristics of underground utilities apparatus and highway","What is the colour of a high voltage (HV) electricity cable?",https://d2ywuokkaz628s.cloudfront.net/training_course/175/submodules/n7LTH4VSyg3C7ulefTQGlIfGcruLM8V2mcANXcNR.jpg,https://d2ywuokkaz628s.cloudfront.net/training_course/175/submodules/n7LTH4VSyg3C7ulefTQGlIfGcruLM8V2mcANXcNR.jpg,n/a,Blue,Red,Yellow,Purple,2
"LO4: 4.2: Identify the distinguishing characteristics of underground utilities apparatus and highway","Which of the following services would be laid within a green service duct?",https://d2ywuokkaz628s.cloudfront.net/training_course/175/submodules/n7LTH4VSyg3C7ulefTQGlIfGcruLM8V2mcANXcNR.jpg,https://d2ywuokkaz628s.cloudfront.net/training_course/175/submodules/n7LTH4VSyg3C7ulefTQGlIfGcruLM8V2mcANXcNR.jpg,n/a,"Cable television",Telecommunications,"Street lighting","Traffic control",1
"LO4: 4.2: Identify the distinguishing characteristics of underground utilities apparatus and highway","What colour are intermediate pressure (IP) gas mains?",https://d2ywuokkaz628s.cloudfront.net/training_course/175/submodules/n7LTH4VSyg3C7ulefTQGlIfGcruLM8V2mcANXcNR.jpg,https://d2ywuokkaz628s.cloudfront.net/training_course/175/submodules/n7LTH4VSyg3C7ulefTQGlIfGcruLM8V2mcANXcNR.jpg,n/a,Yellow,Black,Orange,Red,3
"LO6: 6.1: Define the information recorded within a site specific risk assessment","Which of these should be included in a site-specific risk assessment?",https://d2ywuokkaz628s.cloudfront.net/training_course/175/submodules/n7LTH4VSyg3C7ulefTQGlIfGcruLM8V2mcANXcNR.jpg,https://d2ywuokkaz628s.cloudfront.net/training_course/175/submodules/n7LTH4VSyg3C7ulefTQGlIfGcruLM8V2mcANXcNR.jpg,n/a,"Name of the first aider","Identified hazards of work location","Number of near misses in the last 18 months","Number of near misses in the last 12 months",2
"LO6: 6.1: Define the information recorded within a site specific risk assessment","What is the highest risk to personal safety while detecting and marking underground services on a public highway?",https://d2ywuokkaz628s.cloudfront.net/training_course/175/submodules/n7LTH4VSyg3C7ulefTQGlIfGcruLM8V2mcANXcNR.jpg,https://d2ywuokkaz628s.cloudfront.net/training_course/175/submodules/n7LTH4VSyg3C7ulefTQGlIfGcruLM8V2mcANXcNR.jpg,n/a,"Injury from slips trips and falls","Injury from poor manual handling","Injury from road traffic","Injury from falling into an excavation",3
"LO6: 6.1: Define the information recorded within a site specific risk assessment","What information within a site specific risk assessment would provide you with the precautions to take to safely reduce or eliminate risks?",https://d2ywuokkaz628s.cloudfront.net/training_course/175/submodules/n7LTH4VSyg3C7ulefTQGlIfGcruLM8V2mcANXcNR.jpg,https://d2ywuokkaz628s.cloudfront.net/training_course/175/submodules/n7LTH4VSyg3C7ulefTQGlIfGcruLM8V2mcANXcNR.jpg,n/a,"The control measure","The consequences","The risk rating","The affected people",1
"LO6: 6.1: Define the information recorded within a site specific risk assessment","How is the risk rating calculated on a site specific risk assessment?",https://d2ywuokkaz628s.cloudfront.net/training_course/175/submodules/n7LTH4VSyg3C7ulefTQGlIfGcruLM8V2mcANXcNR.jpg,https://d2ywuokkaz628s.cloudfront.net/training_course/175/submodules/n7LTH4VSyg3C7ulefTQGlIfGcruLM8V2mcANXcNR.jpg,n/a,"Hazard √∑ risk","Likelihood x severity","Consequence √∑ likelihood","Risk x severity",2
"LO6: 6.1: Define the information recorded within a site specific risk assessment","What personal protective equipment (PPE) is used to reduce the risks associated with road traffic when detecting and marking underground services on a public highway?",https://d2ywuokkaz628s.cloudfront.net/training_course/175/submodules/n7LTH4VSyg3C7ulefTQGlIfGcruLM8V2mcANXcNR.jpg,https://d2ywuokkaz628s.cloudfront.net/training_course/175/submodules/n7LTH4VSyg3C7ulefTQGlIfGcruLM8V2mcANXcNR.jpg,n/a,"Safety glasses","Safety footwear","Hard hat","High visibility clothing",4
"LO6: 6.1: Define the information recorded within a site specific risk assessment","When selecting an appropriate control measure to reduce a risk, what does the term ""So far as is reasonably practicable"" mean?",https://d2ywuokkaz628s.cloudfront.net/training_course/175/submodules/n7LTH4VSyg3C7ulefTQGlIfGcruLM8V2mcANXcNR.jpg,https://d2ywuokkaz628s.cloudfront.net/training_course/175/submodules/n7LTH4VSyg3C7ulefTQGlIfGcruLM8V2mcANXcNR.jpg,n/a,"The cost of the control measure is disproportionate to the level of risk","The hazard is cheaper to manage than the risk to employees and the public","The hazard is not worth managing","The level of risk is balanced against cost, time or trouble",4
"LO6: 6.3: State the potential consequences of damaging underground utilities apparatus and highways","What is the most common type of injury associated with damaging electric cables?",https://d2ywuokkaz628s.cloudfront.net/training_course/175/submodules/n7LTH4VSyg3C7ulefTQGlIfGcruLM8V2mcANXcNR.jpg,https://d2ywuokkaz628s.cloudfront.net/training_course/175/submodules/n7LTH4VSyg3C7ulefTQGlIfGcruLM8V2mcANXcNR.jpg,n/a,"Broken limbs",Asphyxiation,Bruising,"Severe burns",4
"LO6: 6.3: State the potential consequences of damaging underground utilities apparatus and highways","What is the most likely consequence of striking liquified petroleum gas (LPG)?",https://d2ywuokkaz628s.cloudfront.net/training_course/175/submodules/n7LTH4VSyg3C7ulefTQGlIfGcruLM8V2mcANXcNR.jpg,https://d2ywuokkaz628s.cloudfront.net/training_course/175/submodules/n7LTH4VSyg3C7ulefTQGlIfGcruLM8V2mcANXcNR.jpg,n/a,"Cold burns",Explosion,Asphyxiation,Headache,2
"LO6: 6.3: State the potential consequences of damaging underground utilities apparatus and highways","What is the most common type of injury associated with damaging gas services?",https://d2ywuokkaz628s.cloudfront.net/training_course/175/submodules/n7LTH4VSyg3C7ulefTQGlIfGcruLM8V2mcANXcNR.jpg,https://d2ywuokkaz628s.cloudfront.net/training_course/175/submodules/n7LTH4VSyg3C7ulefTQGlIfGcruLM8V2mcANXcNR.jpg,n/a,Hypothermia,"Severe burns",Bruising,"Broken bones",2
"LO6: 6.3: State the potential consequences of damaging underground utilities apparatus and highways","What is the most common type of injury associated with damaging water mains?",https://d2ywuokkaz628s.cloudfront.net/training_course/175/submodules/n7LTH4VSyg3C7ulefTQGlIfGcruLM8V2mcANXcNR.jpg,https://d2ywuokkaz628s.cloudfront.net/training_course/175/submodules/n7LTH4VSyg3C7ulefTQGlIfGcruLM8V2mcANXcNR.jpg,n/a,Hypothermia,Asphyxiation,Bruising,"Broken bones",1
"LO6: 6.3: State the potential consequences of damaging underground utilities apparatus and highways","Which of the following items must not be removed under any circumstances when excavating near a water main?",https://d2ywuokkaz628s.cloudfront.net/training_course/175/submodules/n7LTH4VSyg3C7ulefTQGlIfGcruLM8V2mcANXcNR.jpg,https://d2ywuokkaz628s.cloudfront.net/training_course/175/submodules/n7LTH4VSyg3C7ulefTQGlIfGcruLM8V2mcANXcNR.jpg,n/a,"Fine fill and spoil","Trench props","Trench blocks","Sump pumps",3
"LO6: 6.3: State the potential consequences of damaging underground utilities apparatus and highways","What is the main risk to workers following damage to a sewer pipe?",https://d2ywuokkaz628s.cloudfront.net/training_course/175/submodules/n7LTH4VSyg3C7ulefTQGlIfGcruLM8V2mcANXcNR.jpg,https://d2ywuokkaz628s.cloudfront.net/training_course/175/submodules/n7LTH4VSyg3C7ulefTQGlIfGcruLM8V2mcANXcNR.jpg,n/a,Asphyxiation,Drowning,"Trench collapse","Exposure to raw sewage",4
"LO6: 6.4: Define the control measures used to reduce the likelihood and severity of consequences","What control measure should be used to reduce the risk of mechanical excavators damaging gas pipes?",https://d2ywuokkaz628s.cloudfront.net/training_course/175/submodules/n7LTH4VSyg3C7ulefTQGlIfGcruLM8V2mcANXcNR.jpg,https://d2ywuokkaz628s.cloudfront.net/training_course/175/submodules/n7LTH4VSyg3C7ulefTQGlIfGcruLM8V2mcANXcNR.jpg,n/a,"Fit the excavator with restraints to limit its movement with the excavation","Do not use mechanical excavators within 500mm of a gas pipe","Use a banksman to guide the movement slowly over the top of gas pipes","Use a narrow bucket to excavate near gas pipes",2
"LO6: 6.4: Define the control measures used to reduce the likelihood and severity of consequences","Before excavating, what actions should be taken by operatives to reduce the risk of damaging underground utility apparatus and highway services?",https://d2ywuokkaz628s.cloudfront.net/training_course/175/submodules/n7LTH4VSyg3C7ulefTQGlIfGcruLM8V2mcANXcNR.jpg,https://d2ywuokkaz628s.cloudfront.net/training_course/175/submodules/n7LTH4VSyg3C7ulefTQGlIfGcruLM8V2mcANXcNR.jpg,n/a,"Refer to plans and survey the work area to identify and mark the position of services","Erect the appropriate signing, lighting and guarding according for the work area.","Use dowsing sticks and the resident‚'s knowledge to locate services","Carry out a desktop survey using satellite maps to determine potential hazards",1
"LO6: 6.4: Define the control measures used to reduce the likelihood and severity of consequences","What equipment should be used to reduce the risk of trench collapse as a result of a damaged water service?",https://d2ywuokkaz628s.cloudfront.net/training_course/175/submodules/n7LTH4VSyg3C7ulefTQGlIfGcruLM8V2mcANXcNR.jpg,https://d2ywuokkaz628s.cloudfront.net/training_course/175/submodules/n7LTH4VSyg3C7ulefTQGlIfGcruLM8V2mcANXcNR.jpg,n/a,"Sand bags","Shoring equipment","Water pumps","Excavation covers",2
"LO6: 6.4: Define the control measures used to reduce the likelihood and severity of consequences","What documentation should be used to minimise the risk of damaging underground apparatus and services?",https://d2ywuokkaz628s.cloudfront.net/training_course/175/submodules/n7LTH4VSyg3C7ulefTQGlIfGcruLM8V2mcANXcNR.jpg,https://d2ywuokkaz628s.cloudfront.net/training_course/175/submodules/n7LTH4VSyg3C7ulefTQGlIfGcruLM8V2mcANXcNR.jpg,n/a,"Safety at street works and road works: a code of practice","The construction design management (CDM) pack","Site specific risk assessments and method statements","Project notification - form 10",3
"LO6: 6.4: Define the control measures used to reduce the likelihood and severity of consequences","What personal protective equipment (PPE) can be worn to reduce the risks from damaged electric or gas services?",https://d2ywuokkaz628s.cloudfront.net/training_course/175/submodules/n7LTH4VSyg3C7ulefTQGlIfGcruLM8V2mcANXcNR.jpg,https://d2ywuokkaz628s.cloudfront.net/training_course/175/submodules/n7LTH4VSyg3C7ulefTQGlIfGcruLM8V2mcANXcNR.jpg,n/a,"Flame retardant overalls","Breathing apparatus","Safety gloves","Dielectric footwear",1
"LO6: 6.4: Define the control measures used to reduce the likelihood and severity of consequences","What action should be taken when an electrical cable crosses a trench that is more than 1m wide?",https://d2ywuokkaz628s.cloudfront.net/training_course/175/submodules/n7LTH4VSyg3C7ulefTQGlIfGcruLM8V2mcANXcNR.jpg,https://d2ywuokkaz628s.cloudfront.net/training_course/175/submodules/n7LTH4VSyg3C7ulefTQGlIfGcruLM8V2mcANXcNR.jpg,n/a,"Ask the asset owner to provide appropriate support for the cable","Add steel supports and nylon rope tied around the cable joints","Crowd cables using steel wire rope and sling from a concrete support beam","Support the cable at 500mm intervals using strong timber and ratchet straps",4
"LO6: 6.5: State the purpose of contingency plans in relation to damaged underground utilities","What is the purpose of informing the asset owner/operator in the event of damage to a telecommunications service?",https://d2ywuokkaz628s.cloudfront.net/training_course/175/submodules/n7LTH4VSyg3C7ulefTQGlIfGcruLM8V2mcANXcNR.jpg,https://d2ywuokkaz628s.cloudfront.net/training_course/175/submodules/n7LTH4VSyg3C7ulefTQGlIfGcruLM8V2mcANXcNR.jpg,n/a,"To ensure that the service is repaired properly","To ensure no additional damage is done to the service","To reduce the risk of injury of site personnel","To reduce the risk of injury of the public",1
"LO6: 6.5: State the purpose of contingency plans in relation to damaged underground utilities","What is the purpose of keeping people well clear of the work area in the event of an electricity cable being damaged?",https://d2ywuokkaz628s.cloudfront.net/training_course/175/submodules/n7LTH4VSyg3C7ulefTQGlIfGcruLM8V2mcANXcNR.jpg,https://d2ywuokkaz628s.cloudfront.net/training_course/175/submodules/n7LTH4VSyg3C7ulefTQGlIfGcruLM8V2mcANXcNR.jpg,n/a,"To ensure the cable is repaired properly","To ensure no additional damage is done to the cable","To ensure the safety of site personnel and members of the public","To ensure that the work area can be investigated by the employer",3
"LO6: 6.5: State the purpose of contingency plans in relation to damaged underground utilities","What is the purpose of keeping people well clear of the work area in the event of a gas pipe being damaged?",https://d2ywuokkaz628s.cloudfront.net/training_course/175/submodules/n7LTH4VSyg3C7ulefTQGlIfGcruLM8V2mcANXcNR.jpg,https://d2ywuokkaz628s.cloudfront.net/training_course/175/submodules/n7LTH4VSyg3C7ulefTQGlIfGcruLM8V2mcANXcNR.jpg,n/a,"To ensure the pipe is repaired properly","To ensure no additional damage is done to the pipe","To ensure the safety of site personnel and members of the public","To ensure that the work area can be investigated by the employer",3
"LO8: 8.1: Define the operational limitations of different pipe and cable location equipment","Which of the following services would a conventional detection device be unable to locate?",https://d2ywuokkaz628s.cloudfront.net/training_course/175/submodules/n7LTH4VSyg3C7ulefTQGlIfGcruLM8V2mcANXcNR.jpg,https://d2ywuokkaz628s.cloudfront.net/training_course/175/submodules/n7LTH4VSyg3C7ulefTQGlIfGcruLM8V2mcANXcNR.jpg,n/a,"Galvanised steel gas service","Low voltage (LV) electric cable","Polyethylene (PE) water service","Ductile iron water main",3
"LO8: 8.1: Define the operational limitations of different pipe and cable location equipment","What can prevent a detection device used in power mode from being able to locate a live electric cable?",https://d2ywuokkaz628s.cloudfront.net/training_course/175/submodules/n7LTH4VSyg3C7ulefTQGlIfGcruLM8V2mcANXcNR.jpg,https://d2ywuokkaz628s.cloudfront.net/training_course/175/submodules/n7LTH4VSyg3C7ulefTQGlIfGcruLM8V2mcANXcNR.jpg,n/a,"Cable has a current flowing through it","Cables generate a strong magnetic field","Electricity is being drawn from the cable at the time","Cables have direct current (DC) flowing through it",4
"LO8: 8.1: Define the operational limitations of different pipe and cable location equipment","What is an established limitation when using radio frequency detectors to locate metallic pipe?",https://d2ywuokkaz628s.cloudfront.net/training_course/175/submodules/n7LTH4VSyg3C7ulefTQGlIfGcruLM8V2mcANXcNR.jpg,https://d2ywuokkaz628s.cloudfront.net/training_course/175/submodules/n7LTH4VSyg3C7ulefTQGlIfGcruLM8V2mcANXcNR.jpg,n/a,"Other metallic objects can reradiate the signal and results may vary","Metallic pipe can only be located using signal generators","The pipe cannot generate a large enough magnetic field","Plastic objects can generate a stronger radio frequency and results may vary",1
"LO8: 8.1: Define the operational limitations of different pipe and cable location equipment","Which of the following services would a conventional detection device be unable to locate?",https://d2ywuokkaz628s.cloudfront.net/training_course/175/submodules/n7LTH4VSyg3C7ulefTQGlIfGcruLM8V2mcANXcNR.jpg,https://d2ywuokkaz628s.cloudfront.net/training_course/175/submodules/n7LTH4VSyg3C7ulefTQGlIfGcruLM8V2mcANXcNR.jpg,n/a,"Galvanised steel gas service","Low voltage (LV) electric cable","Polyethylene (PE) gas service","Ductile iron water main",3
"LO8: 8.1: Define the operational limitations of different pipe and cable location equipment","Which of the following will prevent a detection device, used in power mode, from being able to locate a live electric cable?",https://d2ywuokkaz628s.cloudfront.net/training_course/175/submodules/n7LTH4VSyg3C7ulefTQGlIfGcruLM8V2mcANXcNR.jpg,https://d2ywuokkaz628s.cloudfront.net/training_course/175/submodules/n7LTH4VSyg3C7ulefTQGlIfGcruLM8V2mcANXcNR.jpg,n/a,"Cables that use alternating current (AC)","Cables that generate a magnetic field","Electricity is being drawn from the cable at the time","Cables where there is little or no current flowing",4
"LO8: 8.1: Define the operational limitations of different pipe and cable location equipment","Why might it be difficult to locate a telecommunication cable when using radio frequency detectors?",https://d2ywuokkaz628s.cloudfront.net/training_course/175/submodules/n7LTH4VSyg3C7ulefTQGlIfGcruLM8V2mcANXcNR.jpg,https://d2ywuokkaz628s.cloudfront.net/training_course/175/submodules/n7LTH4VSyg3C7ulefTQGlIfGcruLM8V2mcANXcNR.jpg,n/a,"The cable crosses the path of a power cable","The cable is well balanced and does not radiate a traceable signal","The cable is too short to radiate a traceable signal","There is a weak current running through the cable",3
