Category,Question,"Question Image","Explanation Image",Explanation,"Option 1","Option 2","Option 3","Option 4",Answer
"LO8: 8.2: State how to select equipment that is fit for purpose","Which of the following statements is a feature of the Provision and Use of Work Equipment Regulations (PUWER)?",https://d2ywuokkaz628s.cloudfront.net/training_course/175/submodules/n7LTH4VSyg3C7ulefTQGlIfGcruLM8V2mcANXcNR.jpg,https://d2ywuokkaz628s.cloudfront.net/training_course/175/submodules/n7LTH4VSyg3C7ulefTQGlIfGcruLM8V2mcANXcNR.jpg,n/a,"The employee is responsible for buying PPE","The HSE is responsible for servicing work equipment","The manufacturer is responsible for training users","The employer is responsible for suitability of work equipment",4
"LO8: 8.2: State how to select equipment that is fit for purpose","How often should detection equipment undergo testing and recalibration?",https://d2ywuokkaz628s.cloudfront.net/training_course/175/submodules/n7LTH4VSyg3C7ulefTQGlIfGcruLM8V2mcANXcNR.jpg,https://d2ywuokkaz628s.cloudfront.net/training_course/175/submodules/n7LTH4VSyg3C7ulefTQGlIfGcruLM8V2mcANXcNR.jpg,n/a,"A minimum of once per year","Dependant on the manufacturer‚'s instructions","Each time the device is used","Every six months with daily pre start checks",2
"LO8: 8.2: State how to select equipment that is fit for purpose","What document will provide an operative with the specific checks to ensure that the selected equipment is fit for purpose before it is used?",https://d2ywuokkaz628s.cloudfront.net/training_course/175/submodules/n7LTH4VSyg3C7ulefTQGlIfGcruLM8V2mcANXcNR.jpg,https://d2ywuokkaz628s.cloudfront.net/training_course/175/submodules/n7LTH4VSyg3C7ulefTQGlIfGcruLM8V2mcANXcNR.jpg,n/a,"The job method statement","The calibration certificate","The site specific risk assessment","The manufacturer‚'s instructions.",4
"LO8: 8.2: State how to select equipment that is fit for purpose","Why should an operative consider the conditions and risks that exist in the intended workplace when selecting equipment?",https://d2ywuokkaz628s.cloudfront.net/training_course/175/submodules/n7LTH4VSyg3C7ulefTQGlIfGcruLM8V2mcANXcNR.jpg,https://d2ywuokkaz628s.cloudfront.net/training_course/175/submodules/n7LTH4VSyg3C7ulefTQGlIfGcruLM8V2mcANXcNR.jpg,n/a,"To ensure that it is suitable for its intended use","To ensure that it can be stored securely and safely","To ensure that maintenance costs are as low as possible","To ensure that the workforce has adequate skills to operate machinery",1
"LO8: 8.2: State how to select equipment that is fit for purpose","Why must the person selecting detection methods have a good understanding of the available equipment and its limitations?",https://d2ywuokkaz628s.cloudfront.net/training_course/175/submodules/n7LTH4VSyg3C7ulefTQGlIfGcruLM8V2mcANXcNR.jpg,https://d2ywuokkaz628s.cloudfront.net/training_course/175/submodules/n7LTH4VSyg3C7ulefTQGlIfGcruLM8V2mcANXcNR.jpg,n/a,"To ensure that the equipment is affordable","To ensure the equipment is fit for purpose","To ensure the equipment is durable","To ensure the users are competent",2
"LO8: 8.2: State how to select equipment that is fit for purpose","Who is responsible for the suitability of work equipment?",https://d2ywuokkaz628s.cloudfront.net/training_course/175/submodules/n7LTH4VSyg3C7ulefTQGlIfGcruLM8V2mcANXcNR.jpg,https://d2ywuokkaz628s.cloudfront.net/training_course/175/submodules/n7LTH4VSyg3C7ulefTQGlIfGcruLM8V2mcANXcNR.jpg,n/a,"The employee","The employer","The manufacturer","The client",2
"LO8: 8.3: Define the procedure for notifying the relevant authority of discrepancies between search","What action should be taken if discrepancies are found between search results and site plans?",https://d2ywuokkaz628s.cloudfront.net/training_course/175/submodules/n7LTH4VSyg3C7ulefTQGlIfGcruLM8V2mcANXcNR.jpg,https://d2ywuokkaz628s.cloudfront.net/training_course/175/submodules/n7LTH4VSyg3C7ulefTQGlIfGcruLM8V2mcANXcNR.jpg,n/a,"Inform the asset owner to allow them to amend their records","Take measurements and ask the site agent to update plans and records","Report the inaccuracy to the HSE as a near miss","Stop work, leave the area and make it secure until the contractor investigates",1
"LO8: 8.3: Define the procedure for notifying the relevant authority of discrepancies between search","What action should be taken if the work completed changes the path or depth of a service and makes the current version of the plans inaccurate?",https://d2ywuokkaz628s.cloudfront.net/training_course/175/submodules/n7LTH4VSyg3C7ulefTQGlIfGcruLM8V2mcANXcNR.jpg,https://d2ywuokkaz628s.cloudfront.net/training_course/175/submodules/n7LTH4VSyg3C7ulefTQGlIfGcruLM8V2mcANXcNR.jpg,n/a,"No action required if the changes are within 500mm","Do not back fill the excavation until the asset owner updates their records","Inform the asset owner and they should amend their records","Take measurements and ask the site agent to update plans and records",3
"LO8: 8.3: Define the procedure for notifying the relevant authority of discrepancies between search","Why must the asset owner be contacted if a service is found to be located well away from its recorded position?",https://d2ywuokkaz628s.cloudfront.net/training_course/175/submodules/n7LTH4VSyg3C7ulefTQGlIfGcruLM8V2mcANXcNR.jpg,https://d2ywuokkaz628s.cloudfront.net/training_course/175/submodules/n7LTH4VSyg3C7ulefTQGlIfGcruLM8V2mcANXcNR.jpg,n/a,"To allow them to correct the position of the service","To allow them to update their records","To allow them to carry out an investigation","To allow them to organise compensation",2
"LO8: 8.4 State the procedure to follow where underground utilities apparatus and highways services","Who can provide additional advice or assistance in the event that services recorded in a plan cannot be located using detection equipment?",https://d2ywuokkaz628s.cloudfront.net/training_course/175/submodules/n7LTH4VSyg3C7ulefTQGlIfGcruLM8V2mcANXcNR.jpg,https://d2ywuokkaz628s.cloudfront.net/training_course/175/submodules/n7LTH4VSyg3C7ulefTQGlIfGcruLM8V2mcANXcNR.jpg,n/a,"The site manager","The asset owner","The local authority","The equipment manufacturer",2
"LO8: 8.4 State the procedure to follow where underground utilities apparatus and highways services","What action should be taken where underground services cannot be found using detection equipment?",https://d2ywuokkaz628s.cloudfront.net/training_course/175/submodules/n7LTH4VSyg3C7ulefTQGlIfGcruLM8V2mcANXcNR.jpg,https://d2ywuokkaz628s.cloudfront.net/training_course/175/submodules/n7LTH4VSyg3C7ulefTQGlIfGcruLM8V2mcANXcNR.jpg,n/a,"Obtain more plans from asset owner","Dig trial holes using safe techniques","Use different detection equipment","Hire a specialist to survey the area",2
"LO8: 8.4 State the procedure to follow where underground utilities apparatus and highways services","What action should be taken where underground services cannot be found using detection equipment or by digging multiple trial holes?",https://d2ywuokkaz628s.cloudfront.net/training_course/175/submodules/n7LTH4VSyg3C7ulefTQGlIfGcruLM8V2mcANXcNR.jpg,https://d2ywuokkaz628s.cloudfront.net/training_course/175/submodules/n7LTH4VSyg3C7ulefTQGlIfGcruLM8V2mcANXcNR.jpg,n/a,"Obtain more information from asset owner","Continue to dig trial holes","Use different detection equipment","Hire a specialist to survey the area",1
"LO2: 2.1 State the purpose of work site surveys and site specific risk assessments","What is the purpose of site specific risk assessments?",https://d2ywuokkaz628s.cloudfront.net/training_course/175/submodules/n7LTH4VSyg3C7ulefTQGlIfGcruLM8V2mcANXcNR.jpg,https://d2ywuokkaz628s.cloudfront.net/training_course/175/submodules/n7LTH4VSyg3C7ulefTQGlIfGcruLM8V2mcANXcNR.jpg,n/a,"To identify the signs to use for the site","To identify the immediate hazards and risks associated with the work","To write a method statement","To comply with the Road Traffic Act",2
"LO2: 2.1 State the purpose of work site surveys and site specific risk assessments","Why should work site surveys be carried out?",https://d2ywuokkaz628s.cloudfront.net/training_course/175/submodules/n7LTH4VSyg3C7ulefTQGlIfGcruLM8V2mcANXcNR.jpg,https://d2ywuokkaz628s.cloudfront.net/training_course/175/submodules/n7LTH4VSyg3C7ulefTQGlIfGcruLM8V2mcANXcNR.jpg,n/a,"To risk assess the location and decide the traffic management layout","To liaise with the appropriate authorities or statutory bodies to plan works","To determine the number of cones and signs required to carry out the work","To obtain any licences, approvals and temporary traffic regulation orders/notices",1
"LO2: 2.1 State the purpose of work site surveys and site specific risk assessments","How should the appropriate traffic management layout and correct equipment be determined ahead of planned works?",https://d2ywuokkaz628s.cloudfront.net/training_course/175/submodules/n7LTH4VSyg3C7ulefTQGlIfGcruLM8V2mcANXcNR.jpg,https://d2ywuokkaz628s.cloudfront.net/training_course/175/submodules/n7LTH4VSyg3C7ulefTQGlIfGcruLM8V2mcANXcNR.jpg,n/a,"By following method statements and permits to work","By following a design provided by the appropriate authority or statutory body","By carrying out a work site survey and site specific risk assessment","By hiring a traffic management company to design and install equipment",3
"LO2: 2.2: State the potential requirements of the location and its users","What action must be taken where motorists cannot see the first sign (Road Works) due to limited visibility?",https://d2ywuokkaz628s.cloudfront.net/training_course/175/submodules/n7LTH4VSyg3C7ulefTQGlIfGcruLM8V2mcANXcNR.jpg,https://d2ywuokkaz628s.cloudfront.net/training_course/175/submodules/n7LTH4VSyg3C7ulefTQGlIfGcruLM8V2mcANXcNR.jpg,n/a,"Use larger signs","Move the safety zone.","Extend the lead in taper","Place additional signs",4
"LO2: 2.2: State the potential requirements of the location and its users","What equipment should be used to provide light vehicle access to premises during excavation work on a footway?",https://d2ywuokkaz628s.cloudfront.net/training_course/175/submodules/n7LTH4VSyg3C7ulefTQGlIfGcruLM8V2mcANXcNR.jpg,https://d2ywuokkaz628s.cloudfront.net/training_course/175/submodules/n7LTH4VSyg3C7ulefTQGlIfGcruLM8V2mcANXcNR.jpg,n/a,"Road plates","Footway boards","Excavation covers","Footway ramps",2
"LO2: 2.2: State the potential requirements of the location and its users","What equipment must be provided to enable pedestrians to negotiate kerbs safely when diverted to temporary walkways in the carriageway?",https://d2ywuokkaz628s.cloudfront.net/training_course/175/submodules/n7LTH4VSyg3C7ulefTQGlIfGcruLM8V2mcANXcNR.jpg,https://d2ywuokkaz628s.cloudfront.net/training_course/175/submodules/n7LTH4VSyg3C7ulefTQGlIfGcruLM8V2mcANXcNR.jpg,n/a,"Road plates","Footway boards","Excavation covers","Footway ramps",4
"LO2: 2.3:Define the factors that influence provision","What traffic control equipment should be used for very short periods when manoeuvring plant or works vehicles on a low risk site?",https://d2ywuokkaz628s.cloudfront.net/training_course/175/submodules/n7LTH4VSyg3C7ulefTQGlIfGcruLM8V2mcANXcNR.jpg,https://d2ywuokkaz628s.cloudfront.net/training_course/175/submodules/n7LTH4VSyg3C7ulefTQGlIfGcruLM8V2mcANXcNR.jpg,n/a,"Portable traffic signals","Stop works sign","Stop and go boards","Priority signs",2
"LO2: 2.3:Define the factors that influence provision","What equipment should be used to assist visually impaired people using an obstructed footway?",https://d2ywuokkaz628s.cloudfront.net/training_course/175/submodules/n7LTH4VSyg3C7ulefTQGlIfGcruLM8V2mcANXcNR.jpg,https://d2ywuokkaz628s.cloudfront.net/training_course/175/submodules/n7LTH4VSyg3C7ulefTQGlIfGcruLM8V2mcANXcNR.jpg,n/a,"Footway ramps","Pedestrian barriers with a tapping rail","Traffic cones and warning lights","Temporary excavation covers",2
"LO2: 2.3:Define the factors that influence provision","On a site, what is the minimum clearance between a works vehicle and the works area on a 40mph road?",https://d2ywuokkaz628s.cloudfront.net/training_course/175/submodules/n7LTH4VSyg3C7ulefTQGlIfGcruLM8V2mcANXcNR.jpg,https://d2ywuokkaz628s.cloudfront.net/training_course/175/submodules/n7LTH4VSyg3C7ulefTQGlIfGcruLM8V2mcANXcNR.jpg,n/a,"2 metres","3 metres","4 metres","5 metres",4
"LO2: 2.4: State how to minimise disruption to and ensure the safety of vehicular traffic","What is the main factor to consider when selecting temporary traffic control?",https://d2ywuokkaz628s.cloudfront.net/training_course/175/submodules/n7LTH4VSyg3C7ulefTQGlIfGcruLM8V2mcANXcNR.jpg,https://d2ywuokkaz628s.cloudfront.net/training_course/175/submodules/n7LTH4VSyg3C7ulefTQGlIfGcruLM8V2mcANXcNR.jpg,n/a,"Type of traffic","Speed of road","Traffic flow","Type of road",3
"LO2: 2.4: State how to minimise disruption to and ensure the safety of vehicular traffic","When using temporary traffic lights, what is the All Red time for a site length of 160m?",https://d2ywuokkaz628s.cloudfront.net/training_course/175/submodules/n7LTH4VSyg3C7ulefTQGlIfGcruLM8V2mcANXcNR.jpg,https://d2ywuokkaz628s.cloudfront.net/training_course/175/submodules/n7LTH4VSyg3C7ulefTQGlIfGcruLM8V2mcANXcNR.jpg,n/a,"10 seconds","15 seconds","20 seconds","25 seconds",3
"LO2: 2.4: State how to minimise disruption to and ensure the safety of vehicular traffic","Which of the following portable traffic signal controls reduces delay to vehicles by ensuring that the green time is adjusted automatically?",https://d2ywuokkaz628s.cloudfront.net/training_course/175/submodules/n7LTH4VSyg3C7ulefTQGlIfGcruLM8V2mcANXcNR.jpg,https://d2ywuokkaz628s.cloudfront.net/training_course/175/submodules/n7LTH4VSyg3C7ulefTQGlIfGcruLM8V2mcANXcNR.jpg,n/a,"Vehicle Actuated (VA)","Manual (MAN)","Fixed time (FT)","All Red",1
"LO2: 2.5: Identify the circumstances in which mobile and short duration works would be applicable.","What type of work can be carried out at one or more intermittent stops, each lasting less than 60 minutes (30 minutes in Scotland)?",https://d2ywuokkaz628s.cloudfront.net/training_course/175/submodules/n7LTH4VSyg3C7ulefTQGlIfGcruLM8V2mcANXcNR.jpg,https://d2ywuokkaz628s.cloudfront.net/training_course/175/submodules/n7LTH4VSyg3C7ulefTQGlIfGcruLM8V2mcANXcNR.jpg,n/a,"Short-duration static work","Emergency works","Mobile works","Minor works",1
"LO2: 2.5: Identify the circumstances in which mobile and short duration works would be applicable.","What type of work is carried out from a vehicle moving significantly slower than the general traffic?",https://d2ywuokkaz628s.cloudfront.net/training_course/175/submodules/n7LTH4VSyg3C7ulefTQGlIfGcruLM8V2mcANXcNR.jpg,https://d2ywuokkaz628s.cloudfront.net/training_course/175/submodules/n7LTH4VSyg3C7ulefTQGlIfGcruLM8V2mcANXcNR.jpg,n/a,"Short-duration static works","Emergency works","Mobile works","Minor works",3
"LO2: 2.5: Identify the circumstances in which mobile and short duration works would be applicable.","When should mobile and short-duration static works be carried out?",https://d2ywuokkaz628s.cloudfront.net/training_course/175/submodules/n7LTH4VSyg3C7ulefTQGlIfGcruLM8V2mcANXcNR.jpg,https://d2ywuokkaz628s.cloudfront.net/training_course/175/submodules/n7LTH4VSyg3C7ulefTQGlIfGcruLM8V2mcANXcNR.jpg,n/a,"When HGVs and buses are diverted to alternative routes","During periods of low risk when there is good visibility","When the length of the works is 80 metres or less","When two-way traffic flow is no more than 400 vehicles per hour",2
"LO4: 4.1: Define the personal protective equipment required for signing, lighting and guarding","Which combination of Personal Protective Equipment (PPE) should be used when removing signs from a carriageway and loading them onto a stationary vehicle?",https://d2ywuokkaz628s.cloudfront.net/training_course/175/submodules/n7LTH4VSyg3C7ulefTQGlIfGcruLM8V2mcANXcNR.jpg,https://d2ywuokkaz628s.cloudfront.net/training_course/175/submodules/n7LTH4VSyg3C7ulefTQGlIfGcruLM8V2mcANXcNR.jpg,n/a,"Safety helmet, high-visibility vest, safety footwear and eye protection","High-visibility clothing, safety footwear, safety gloves and eye protection","High-visibility clothing, helmet, safety gloves and safety footwear","Safety helmet, high-visibility clothing, ear defenders and safety footwear",3
"LO4: 4.1: Define the personal protective equipment required for signing, lighting and guarding","How should an employee determine the correct level of personal protective equipment (PPE) for signing, lighting and guarding activities?",https://d2ywuokkaz628s.cloudfront.net/training_course/175/submodules/n7LTH4VSyg3C7ulefTQGlIfGcruLM8V2mcANXcNR.jpg,https://d2ywuokkaz628s.cloudfront.net/training_course/175/submodules/n7LTH4VSyg3C7ulefTQGlIfGcruLM8V2mcANXcNR.jpg,n/a,"Follow pre populated method statements","Carry out a site specific risk assessment","Mandate a standard selection of PPE","Follow the HSE guidance for standard PPE",2
"LO4: 4.1: Define the personal protective equipment required for signing, lighting and guarding","What is the most appropriate combination of personal protective equipment (PPE) when setting out signing, lighting and guarding?",https://d2ywuokkaz628s.cloudfront.net/training_course/175/submodules/n7LTH4VSyg3C7ulefTQGlIfGcruLM8V2mcANXcNR.jpg,https://d2ywuokkaz628s.cloudfront.net/training_course/175/submodules/n7LTH4VSyg3C7ulefTQGlIfGcruLM8V2mcANXcNR.jpg,n/a,"High-visibility clothing, safety helmet, safety gloves and safety footwear","Safety helmet, high-visibility clothing, safety footwear and eye protection","High-visibility clothing, safety footwear, safety gloves and eye protection","Safety helmet, high-visibility clothing, ear defenders and safety footwear",1
"LO4: 4.2: State how to control the movement of pedestrians, vehicles and plant","What area of the site layout should plant be operated and manoeuvred in?",https://d2ywuokkaz628s.cloudfront.net/training_course/175/submodules/n7LTH4VSyg3C7ulefTQGlIfGcruLM8V2mcANXcNR.jpg,https://d2ywuokkaz628s.cloudfront.net/training_course/175/submodules/n7LTH4VSyg3C7ulefTQGlIfGcruLM8V2mcANXcNR.jpg,n/a,"Works area","Safety zone","Working space","Lead in taper",3
"LO4: 4.2: State how to control the movement of pedestrians, vehicles and plant","On a static site, what is the minimum clearance between a works vehicle and the works area on a 30mph road?",https://d2ywuokkaz628s.cloudfront.net/training_course/175/submodules/n7LTH4VSyg3C7ulefTQGlIfGcruLM8V2mcANXcNR.jpg,https://d2ywuokkaz628s.cloudfront.net/training_course/175/submodules/n7LTH4VSyg3C7ulefTQGlIfGcruLM8V2mcANXcNR.jpg,n/a,2m,3m,4m,5m,1
"LO4: 4.2: State how to control the movement of pedestrians, vehicles and plant","What should be used to segregate pedestrians from any works?",https://d2ywuokkaz628s.cloudfront.net/training_course/175/submodules/n7LTH4VSyg3C7ulefTQGlIfGcruLM8V2mcANXcNR.jpg,https://d2ywuokkaz628s.cloudfront.net/training_course/175/submodules/n7LTH4VSyg3C7ulefTQGlIfGcruLM8V2mcANXcNR.jpg,n/a,"Road traffic cones and rope","A barrier system incorporating a tapping rail","Plastic mesh mounted on road pins","Road traffic cones and pedestrian signs",2
"LO4: 4.3: Define the distances and dimensions to accommodate advance signing","What is the minimum size of signage permitted on single carriageway roads with a speed limit of 40mph?",https://d2ywuokkaz628s.cloudfront.net/training_course/175/submodules/n7LTH4VSyg3C7ulefTQGlIfGcruLM8V2mcANXcNR.jpg,https://d2ywuokkaz628s.cloudfront.net/training_course/175/submodules/n7LTH4VSyg3C7ulefTQGlIfGcruLM8V2mcANXcNR.jpg,n/a,600mm,750mm,800mm,850mm,2
"LO4: 4.3: Define the distances and dimensions to accommodate advance signing","What determines the siting distance to the first sign on a single carriageway static site?",https://d2ywuokkaz628s.cloudfront.net/training_course/175/submodules/n7LTH4VSyg3C7ulefTQGlIfGcruLM8V2mcANXcNR.jpg,https://d2ywuokkaz628s.cloudfront.net/training_course/175/submodules/n7LTH4VSyg3C7ulefTQGlIfGcruLM8V2mcANXcNR.jpg,n/a,"Duration of the work","Volume of traffic","Speed of road","Type of traffic",3
"LO4: 4.3: Define the distances and dimensions to accommodate advance signing","What is the minimum siting distance to the first sign on a single carriageway 50mph road?",https://d2ywuokkaz628s.cloudfront.net/training_course/175/submodules/n7LTH4VSyg3C7ulefTQGlIfGcruLM8V2mcANXcNR.jpg,https://d2ywuokkaz628s.cloudfront.net/training_course/175/submodules/n7LTH4VSyg3C7ulefTQGlIfGcruLM8V2mcANXcNR.jpg,n/a,45m,110m,275m,450m,3
"LO4: 4.3: Define the distances and dimensions to accommodate advance signing","What is the minimum size of a temporary sign to use on a 50mph road?",https://d2ywuokkaz628s.cloudfront.net/training_course/175/submodules/n7LTH4VSyg3C7ulefTQGlIfGcruLM8V2mcANXcNR.jpg,https://d2ywuokkaz628s.cloudfront.net/training_course/175/submodules/n7LTH4VSyg3C7ulefTQGlIfGcruLM8V2mcANXcNR.jpg,n/a,650mm,750mm,800mm,850mm,2
"LO4: 4.3: Define the distances and dimensions to accommodate advance signing","What is the minimum visibility distance to the first sign for a single carriageway with a speed limit of 50mph or more?",https://d2ywuokkaz628s.cloudfront.net/training_course/175/submodules/n7LTH4VSyg3C7ulefTQGlIfGcruLM8V2mcANXcNR.jpg,https://d2ywuokkaz628s.cloudfront.net/training_course/175/submodules/n7LTH4VSyg3C7ulefTQGlIfGcruLM8V2mcANXcNR.jpg,n/a,60,65,70,75,4
"LO4: 4.3: Define the distances and dimensions to accommodate advance signing","When must the 'Road Works End' sign be used?",https://d2ywuokkaz628s.cloudfront.net/training_course/175/submodules/n7LTH4VSyg3C7ulefTQGlIfGcruLM8V2mcANXcNR.jpg,https://d2ywuokkaz628s.cloudfront.net/training_course/175/submodules/n7LTH4VSyg3C7ulefTQGlIfGcruLM8V2mcANXcNR.jpg,n/a,"Where the site length exceeds 50m","Where visibility through the works is restricted","When instructed by the highway authority","On sites where the Stop Works signs are used",1
"LO4: 4.4: Define the criteria to accommodate pedestrian walkways, traffic lanes, safety zones","When working on a footway, what is the ideal width to leave for pedestrians?",https://d2ywuokkaz628s.cloudfront.net/training_course/175/submodules/n7LTH4VSyg3C7ulefTQGlIfGcruLM8V2mcANXcNR.jpg,https://d2ywuokkaz628s.cloudfront.net/training_course/175/submodules/n7LTH4VSyg3C7ulefTQGlIfGcruLM8V2mcANXcNR.jpg,n/a,0.5m,1.0m,1.5m,2.0m.,3
"LO4: 4.4: Define the criteria to accommodate pedestrian walkways, traffic lanes, safety zones","What is the absolute minimum width of the shuttle lane for normal traffic using Stop and Go traffic control?",https://d2ywuokkaz628s.cloudfront.net/training_course/175/submodules/n7LTH4VSyg3C7ulefTQGlIfGcruLM8V2mcANXcNR.jpg,https://d2ywuokkaz628s.cloudfront.net/training_course/175/submodules/n7LTH4VSyg3C7ulefTQGlIfGcruLM8V2mcANXcNR.jpg,n/a,2m,2.5m,3m,3.5m,3
"LO4: 4.4: Define the criteria to accommodate pedestrian walkways, traffic lanes, safety zones","What is the absolute minimum unobstructed width on an existing footway?",https://d2ywuokkaz628s.cloudfront.net/training_course/175/submodules/n7LTH4VSyg3C7ulefTQGlIfGcruLM8V2mcANXcNR.jpg,https://d2ywuokkaz628s.cloudfront.net/training_course/175/submodules/n7LTH4VSyg3C7ulefTQGlIfGcruLM8V2mcANXcNR.jpg,n/a,0.5m,1m,1.5m,2m,2
"LO4: 4.4: Define the criteria to accommodate pedestrian walkways, traffic lanes, safety zones","What is the minimum sideways safety zone on a road with a maximum speed limit of 40mph?",https://d2ywuokkaz628s.cloudfront.net/training_course/175/submodules/n7LTH4VSyg3C7ulefTQGlIfGcruLM8V2mcANXcNR.jpg,https://d2ywuokkaz628s.cloudfront.net/training_course/175/submodules/n7LTH4VSyg3C7ulefTQGlIfGcruLM8V2mcANXcNR.jpg,n/a,0.5m,1.2m,15m,30m,1
"LO4: 4.4: Define the criteria to accommodate pedestrian walkways, traffic lanes, safety zones","What is the main purpose of a safety zone?",https://d2ywuokkaz628s.cloudfront.net/training_course/175/submodules/n7LTH4VSyg3C7ulefTQGlIfGcruLM8V2mcANXcNR.jpg,https://d2ywuokkaz628s.cloudfront.net/training_course/175/submodules/n7LTH4VSyg3C7ulefTQGlIfGcruLM8V2mcANXcNR.jpg,n/a,"To protect pedestrians from the works","To protect site operatives from passing traffic","To allow for temporary traffic control to be used","To keep pedestrians at a safe distance from site vehicles",2
"LO4: 4.4: Define the criteria to accommodate pedestrian walkways, traffic lanes, safety zones","What is the minimum width of a temporary walkway in the carriageway in order for a visually impaired person being guided to pass safely?",https://d2ywuokkaz628s.cloudfront.net/training_course/175/submodules/n7LTH4VSyg3C7ulefTQGlIfGcruLM8V2mcANXcNR.jpg,https://d2ywuokkaz628s.cloudfront.net/training_course/175/submodules/n7LTH4VSyg3C7ulefTQGlIfGcruLM8V2mcANXcNR.jpg,n/a,"1.0 metres","1.2 metres","1.4 metres","1.6 metres",2
"LO4: 4.5: State the requirements for the installation and use of warning lights","What is the maximum permitted height of warning lights on a 40mph road?",https://d2ywuokkaz628s.cloudfront.net/training_course/175/submodules/n7LTH4VSyg3C7ulefTQGlIfGcruLM8V2mcANXcNR.jpg,https://d2ywuokkaz628s.cloudfront.net/training_course/175/submodules/n7LTH4VSyg3C7ulefTQGlIfGcruLM8V2mcANXcNR.jpg,n/a,"1.2 metres","1.3 metres","1.4 metres","1.5 metres",4
"LO4: 4.5: State the requirements for the installation and use of warning lights","Which of the following speed limits are flashing warning lights not permitted to be used where the road is street lit?",https://d2ywuokkaz628s.cloudfront.net/training_course/175/submodules/n7LTH4VSyg3C7ulefTQGlIfGcruLM8V2mcANXcNR.jpg,https://d2ywuokkaz628s.cloudfront.net/training_course/175/submodules/n7LTH4VSyg3C7ulefTQGlIfGcruLM8V2mcANXcNR.jpg,n/a,20mph,30mph,40mph,50mph,4
"LO4: 4.5: State the requirements for the installation and use of warning lights","What is the maximum permitted height of warning lights on a 50mph road?",https://d2ywuokkaz628s.cloudfront.net/training_course/175/submodules/n7LTH4VSyg3C7ulefTQGlIfGcruLM8V2mcANXcNR.jpg,https://d2ywuokkaz628s.cloudfront.net/training_course/175/submodules/n7LTH4VSyg3C7ulefTQGlIfGcruLM8V2mcANXcNR.jpg,n/a,"1.2 metres","1.3 metres","1.4 metres","1.5 metres",1
