Category,Question,"Question Image","Explanation Image",Explanation,"Option 1","Option 2","Option 3","Option 4",Answer
"LO4: 4.6: Define how signs, barriers, footway boards, ramps and road plates are securely installed","What is the recommended method to secure road signs?",https://d2ywuokkaz628s.cloudfront.net/training_course/175/submodules/n7LTH4VSyg3C7ulefTQGlIfGcruLM8V2mcANXcNR.jpg,https://d2ywuokkaz628s.cloudfront.net/training_course/175/submodules/n7LTH4VSyg3C7ulefTQGlIfGcruLM8V2mcANXcNR.jpg,n/a,"Use a sign with built-in weights","Use a sign with barrels or kerbstones","Use a sign with ballast or cross bracing","Use a sign with road pins or heaped spoil",1
"LO4: 4.6: Define how signs, barriers, footway boards, ramps and road plates are securely installed","How should pedestrian barriers be protected from continual unauthorised alterations and separation?",https://d2ywuokkaz628s.cloudfront.net/training_course/175/submodules/n7LTH4VSyg3C7ulefTQGlIfGcruLM8V2mcANXcNR.jpg,https://d2ywuokkaz628s.cloudfront.net/training_course/175/submodules/n7LTH4VSyg3C7ulefTQGlIfGcruLM8V2mcANXcNR.jpg,n/a,"Use barriers with enhanced guarding","Use ballast or cross bracing to secure","Use vandal proof paint to protect equipment","Use clamps or ties that require a tool for removal",4
"LO4: 4.6: Define how signs, barriers, footway boards, ramps and road plates are securely installed","What additional measures could be used to securely install pedestrian barriers in strong winds?",https://d2ywuokkaz628s.cloudfront.net/training_course/175/submodules/n7LTH4VSyg3C7ulefTQGlIfGcruLM8V2mcANXcNR.jpg,https://d2ywuokkaz628s.cloudfront.net/training_course/175/submodules/n7LTH4VSyg3C7ulefTQGlIfGcruLM8V2mcANXcNR.jpg,n/a,"Use enhanced guarding","Use road pins or heaped spoil","Use ballast or cross-bracing","Use barrels or kerbstones",3
"LO4: 4.7: State how to check that equipment is fit for purpose","What is the minimum distance the lower edge of all signs should be from ground level?",https://d2ywuokkaz628s.cloudfront.net/training_course/175/submodules/n7LTH4VSyg3C7ulefTQGlIfGcruLM8V2mcANXcNR.jpg,https://d2ywuokkaz628s.cloudfront.net/training_course/175/submodules/n7LTH4VSyg3C7ulefTQGlIfGcruLM8V2mcANXcNR.jpg,n/a,200mm,300mm,400mm,500mm,2
"LO4: 4.7: State how to check that equipment is fit for purpose","What standard must the size, shape and style of signs and traffic cones comply with?",https://d2ywuokkaz628s.cloudfront.net/training_course/175/submodules/n7LTH4VSyg3C7ulefTQGlIfGcruLM8V2mcANXcNR.jpg,https://d2ywuokkaz628s.cloudfront.net/training_course/175/submodules/n7LTH4VSyg3C7ulefTQGlIfGcruLM8V2mcANXcNR.jpg,n/a,"Red book","Pink book","TSRGD or TSR (NI)","TAL 2/11 and 3/11",3
"LO4: 4.7: State how to check that equipment is fit for purpose","How often should equipment be checked at an attended site to ensure it is not damaged or dirty?",https://d2ywuokkaz628s.cloudfront.net/training_course/175/submodules/n7LTH4VSyg3C7ulefTQGlIfGcruLM8V2mcANXcNR.jpg,https://d2ywuokkaz628s.cloudfront.net/training_course/175/submodules/n7LTH4VSyg3C7ulefTQGlIfGcruLM8V2mcANXcNR.jpg,n/a,"At the end of every shift with a thorough inspection once a week","An inspection should be carried out once a day by a competent person","The timing of checks should be determined by a risk assessment","At the start of work, regularly during work and before you leave site",4
"LO4: 4.8: Specify the sequences for installing, positioning and removing equipment.","What sign should be set up first when installing advanced signing?",https://d2ywuokkaz628s.cloudfront.net/training_course/175/submodules/n7LTH4VSyg3C7ulefTQGlIfGcruLM8V2mcANXcNR.jpg,https://d2ywuokkaz628s.cloudfront.net/training_course/175/submodules/n7LTH4VSyg3C7ulefTQGlIfGcruLM8V2mcANXcNR.jpg,n/a,"Keep right","Road works ahead","Road narrows ahead","Information board",2
"LO4: 4.8: Specify the sequences for installing, positioning and removing equipment.","Which sign should be placed immediately after the Road Works sign when using a Give and Take method of control?",https://d2ywuokkaz628s.cloudfront.net/training_course/175/submodules/n7LTH4VSyg3C7ulefTQGlIfGcruLM8V2mcANXcNR.jpg,https://d2ywuokkaz628s.cloudfront.net/training_course/175/submodules/n7LTH4VSyg3C7ulefTQGlIfGcruLM8V2mcANXcNR.jpg,n/a,"Traffic Signals Ahead","Traffic Control Ahead","Road Narrows with Single File Traffic supplementary plate","Road Narrows without Single File Traffic supplementary plate",3
"LO4: 4.8: Specify the sequences for installing, positioning and removing equipment.","Which sign should be placed immediately after the ‚'Road Narrows‚' sign when using a ‚'Stop and Go‚' method of control?",https://d2ywuokkaz628s.cloudfront.net/training_course/175/submodules/n7LTH4VSyg3C7ulefTQGlIfGcruLM8V2mcANXcNR.jpg,https://d2ywuokkaz628s.cloudfront.net/training_course/175/submodules/n7LTH4VSyg3C7ulefTQGlIfGcruLM8V2mcANXcNR.jpg,n/a,"When Stop Sign Shows Wait Here","Traffic Control Ahead","Road Narrows","Direction Arrow",1
"LO6: 6.1: Define the checks carried out to ensure that signals are operating correctly","What must be on site in the event that temporary traffic signals fail?",https://d2ywuokkaz628s.cloudfront.net/training_course/175/submodules/n7LTH4VSyg3C7ulefTQGlIfGcruLM8V2mcANXcNR.jpg,https://d2ywuokkaz628s.cloudfront.net/training_course/175/submodules/n7LTH4VSyg3C7ulefTQGlIfGcruLM8V2mcANXcNR.jpg,n/a,"Priority signs","Stop and go boards","Stop works signs","Additional traffic cones",2
"LO6: 6.1: Define the checks carried out to ensure that signals are operating correctly","Which mode on temporary traffic signals can be used where one of the vehicle detectors has failed?",https://d2ywuokkaz628s.cloudfront.net/training_course/175/submodules/n7LTH4VSyg3C7ulefTQGlIfGcruLM8V2mcANXcNR.jpg,https://d2ywuokkaz628s.cloudfront.net/training_course/175/submodules/n7LTH4VSyg3C7ulefTQGlIfGcruLM8V2mcANXcNR.jpg,n/a,"Switch off","Fixed time","All red","Vehicle actuation",2
"LO6: 6.1: Define the checks carried out to ensure that signals are operating correctly","What is the possible cause of portable traffic signals not changing after one stream of traffic has passed, even though vehicles are waiting?",https://d2ywuokkaz628s.cloudfront.net/training_course/175/submodules/n7LTH4VSyg3C7ulefTQGlIfGcruLM8V2mcANXcNR.jpg,https://d2ywuokkaz628s.cloudfront.net/training_course/175/submodules/n7LTH4VSyg3C7ulefTQGlIfGcruLM8V2mcANXcNR.jpg,n/a,"Low vehicular density","All-Red setting too long","Switched to Fixed Time","Faulty detector (MVD)",4
"LO6: 6.2: State how the site location requirements affect the positioning of signals","What is the maximum site length for using temporary traffic signals?",https://d2ywuokkaz628s.cloudfront.net/training_course/175/submodules/n7LTH4VSyg3C7ulefTQGlIfGcruLM8V2mcANXcNR.jpg,https://d2ywuokkaz628s.cloudfront.net/training_course/175/submodules/n7LTH4VSyg3C7ulefTQGlIfGcruLM8V2mcANXcNR.jpg,n/a,100m,200m,300m,400m,3
"LO6: 6.2: State how the site location requirements affect the positioning of signals","What action should be taken where drivers at the ‚'Wait Here‚' sign have poor visibility of portable traffic signals?",https://d2ywuokkaz628s.cloudfront.net/training_course/175/submodules/n7LTH4VSyg3C7ulefTQGlIfGcruLM8V2mcANXcNR.jpg,https://d2ywuokkaz628s.cloudfront.net/training_course/175/submodules/n7LTH4VSyg3C7ulefTQGlIfGcruLM8V2mcANXcNR.jpg,n/a,"Use convoy working to control traffic","Use stop and go boards alternatively","Use additional signs to control traffic","Use an additional signal head on the approach",4
"LO6: 6.2: State how the site location requirements affect the positioning of signals","Within what distance must portable traffic signals not be used near a railway level crossing with wig-wag traffic signals?",https://d2ywuokkaz628s.cloudfront.net/training_course/175/submodules/n7LTH4VSyg3C7ulefTQGlIfGcruLM8V2mcANXcNR.jpg,https://d2ywuokkaz628s.cloudfront.net/training_course/175/submodules/n7LTH4VSyg3C7ulefTQGlIfGcruLM8V2mcANXcNR.jpg,n/a,"50 metres","75 metres.","100 metres","125 metres",1
"LO6: 6.3: Specify the correct sequence for installing, positioning, dismantling and removing signals","What action should be taken to keep traffic disruption to a minimum when installing and commissioning portable traffic signals?",https://d2ywuokkaz628s.cloudfront.net/training_course/175/submodules/n7LTH4VSyg3C7ulefTQGlIfGcruLM8V2mcANXcNR.jpg,https://d2ywuokkaz628s.cloudfront.net/training_course/175/submodules/n7LTH4VSyg3C7ulefTQGlIfGcruLM8V2mcANXcNR.jpg,n/a,"Signs and equipment should be placed ready for use and signals tested","Use stop and go boards until portable traffic signals are installed","Install signals first on all red setting until advance signs are in place","Use priority signs until portable traffic signals are installed",1
"LO6: 6.3: Specify the correct sequence for installing, positioning, dismantling and removing signals","Where can you find information on the installation and set-up of portable traffic controls?",https://d2ywuokkaz628s.cloudfront.net/training_course/175/submodules/n7LTH4VSyg3C7ulefTQGlIfGcruLM8V2mcANXcNR.jpg,https://d2ywuokkaz628s.cloudfront.net/training_course/175/submodules/n7LTH4VSyg3C7ulefTQGlIfGcruLM8V2mcANXcNR.jpg,n/a,"The Pink Book","The Red Book","TSM Chapter 8","TSRGD or TSR (NI)",1
"LO6: 6.3: Specify the correct sequence for installing, positioning, dismantling and removing signals","Why must you have stop and go boards on site when installing, positioning, maintaining and removing portable traffic signals?",https://d2ywuokkaz628s.cloudfront.net/training_course/175/submodules/n7LTH4VSyg3C7ulefTQGlIfGcruLM8V2mcANXcNR.jpg,https://d2ywuokkaz628s.cloudfront.net/training_course/175/submodules/n7LTH4VSyg3C7ulefTQGlIfGcruLM8V2mcANXcNR.jpg,n/a,"To allow for the installation of signs and signals","In case traffic signals have no all red function","To allow the operatives to adjust the settings","In case the portable traffic signals breakdown",4
"LO6: 6.4:  Define how the traffic conditions affect the adjustment of signal controls and timings","When using temporary traffic lights, what is the All Red time for a site length of 230m?",https://d2ywuokkaz628s.cloudfront.net/training_course/175/submodules/n7LTH4VSyg3C7ulefTQGlIfGcruLM8V2mcANXcNR.jpg,https://d2ywuokkaz628s.cloudfront.net/training_course/175/submodules/n7LTH4VSyg3C7ulefTQGlIfGcruLM8V2mcANXcNR.jpg,n/a,"15 seconds","20 seconds","25 seconds","30 seconds",3
"LO6: 6.4:  Define how the traffic conditions affect the adjustment of signal controls and timings","When using temporary traffic lights what alteration to the timings should be made where the last vehicle does not leave the shuttle lane at the start of the next green?",https://d2ywuokkaz628s.cloudfront.net/training_course/175/submodules/n7LTH4VSyg3C7ulefTQGlIfGcruLM8V2mcANXcNR.jpg,https://d2ywuokkaz628s.cloudfront.net/training_course/175/submodules/n7LTH4VSyg3C7ulefTQGlIfGcruLM8V2mcANXcNR.jpg,n/a,"Increase the all red periods","Decrease the maximum green time","Decrease the all red periods","Increase both maximum green and all red periods",1
"LO6: 6.4:  Define how the traffic conditions affect the adjustment of signal controls and timings","What action should be taken where substantial queues begin to form and vehicles take more than one green period to get through the site?",https://d2ywuokkaz628s.cloudfront.net/training_course/175/submodules/n7LTH4VSyg3C7ulefTQGlIfGcruLM8V2mcANXcNR.jpg,https://d2ywuokkaz628s.cloudfront.net/training_course/175/submodules/n7LTH4VSyg3C7ulefTQGlIfGcruLM8V2mcANXcNR.jpg,n/a,"Switch the signal setting to manual (MAN)","Adjust the all-red setting incrementally","Adjust the maximum green setting incrementally","Switch the signal setting to fixed time (FT)",3
"LO6: 6.5: Specify the appropriate site conditions","What is the maximum coned length of a site when using Stop and Go traffic control where the traffic count is 63 vehicles counted over a 3 minute period?",https://d2ywuokkaz628s.cloudfront.net/training_course/175/submodules/n7LTH4VSyg3C7ulefTQGlIfGcruLM8V2mcANXcNR.jpg,https://d2ywuokkaz628s.cloudfront.net/training_course/175/submodules/n7LTH4VSyg3C7ulefTQGlIfGcruLM8V2mcANXcNR.jpg,n/a,"100 metres","200 metres","300 metres","400 metres",2
"LO6: 6.5: Specify the appropriate site conditions","When using priority signs to control traffic on a 40mph road, what distance should the required visibility be?",https://d2ywuokkaz628s.cloudfront.net/training_course/175/submodules/n7LTH4VSyg3C7ulefTQGlIfGcruLM8V2mcANXcNR.jpg,https://d2ywuokkaz628s.cloudfront.net/training_course/175/submodules/n7LTH4VSyg3C7ulefTQGlIfGcruLM8V2mcANXcNR.jpg,n/a,"50 metres","60 metres","70 metres","80 metres",3
"LO6: 6.5: Specify the appropriate site conditions","What is the maximum speed limit of a road or street when controlling traffic using the ‚'Give and Take‚' method?",https://d2ywuokkaz628s.cloudfront.net/training_course/175/submodules/n7LTH4VSyg3C7ulefTQGlIfGcruLM8V2mcANXcNR.jpg,https://d2ywuokkaz628s.cloudfront.net/training_course/175/submodules/n7LTH4VSyg3C7ulefTQGlIfGcruLM8V2mcANXcNR.jpg,n/a,30mph,40mph,50mph,60mph,1
"LO1: 1.3 Identify the characteristics of recognised footway and carriageway designs","What are the characteristics of a rigid construction?",https://d2ywuokkaz628s.cloudfront.net/training_course/175/submodules/n7LTH4VSyg3C7ulefTQGlIfGcruLM8V2mcANXcNR.jpg,https://d2ywuokkaz628s.cloudfront.net/training_course/175/submodules/n7LTH4VSyg3C7ulefTQGlIfGcruLM8V2mcANXcNR.jpg,n/a,"A structure where the concrete road slab also performs the function of the base","The course layers are either bound or unbound with a bituminous binder","The surface consists of setts, blocks or pavers laid on an appropriate bedding layer","A structure composed of lean mix concrete, normally with bituminous surfacing layers",1
"LO1: 1.3 Identify the characteristics of recognised footway and carriageway designs","What is the configuration of a composite road?",https://d2ywuokkaz628s.cloudfront.net/training_course/175/submodules/n7LTH4VSyg3C7ulefTQGlIfGcruLM8V2mcANXcNR.jpg,https://d2ywuokkaz628s.cloudfront.net/training_course/175/submodules/n7LTH4VSyg3C7ulefTQGlIfGcruLM8V2mcANXcNR.jpg,n/a,"Composed of setts, blocks, pavers or slabs laid on appropriate sub-construction","Composed of either bituminous or granular base material or a combination thereof","Composed of concrete, the surface slab performs the function of the base","Composed of cement bound granular material with bituminous surfacing layers",4
"LO1: 1.3 Identify the characteristics of recognised footway and carriageway designs","What is a modular footway?",https://d2ywuokkaz628s.cloudfront.net/training_course/175/submodules/n7LTH4VSyg3C7ulefTQGlIfGcruLM8V2mcANXcNR.jpg,https://d2ywuokkaz628s.cloudfront.net/training_course/175/submodules/n7LTH4VSyg3C7ulefTQGlIfGcruLM8V2mcANXcNR.jpg,n/a,"A structure composed of cement bound granular material with bituminous surfacing layers","A structure where the base is composed of either bituminous or granular material","A structure where the surface is composed of setts, blocks, pavers or paving slabs","A structure where the concrete road slab also performs the function of the base",3
"LO1: 1.4 Establish the characteristics of high duty and high amenity","What is a high duty footway?",https://d2ywuokkaz628s.cloudfront.net/training_course/175/submodules/n7LTH4VSyg3C7ulefTQGlIfGcruLM8V2mcANXcNR.jpg,https://d2ywuokkaz628s.cloudfront.net/training_course/175/submodules/n7LTH4VSyg3C7ulefTQGlIfGcruLM8V2mcANXcNR.jpg,n/a,"A route which has been surfaced for decorative purposes","A principle route used by equestrians, cyclists and pedestrians","A principle route used by a large number of pedestrians","A route which the public have a right of way on foot only",3
"LO1: 1.4 Establish the characteristics of high duty and high amenity","What is a high amenity route?",https://d2ywuokkaz628s.cloudfront.net/training_course/175/submodules/n7LTH4VSyg3C7ulefTQGlIfGcruLM8V2mcANXcNR.jpg,https://d2ywuokkaz628s.cloudfront.net/training_course/175/submodules/n7LTH4VSyg3C7ulefTQGlIfGcruLM8V2mcANXcNR.jpg,n/a,"A route constructed to a high standard with decorative, textured or coloured finish","A route constructed specifically for the use of cyclists and equestrians","A route constructed from loose material which requires little or no maintenance","A route constructed to be used by an exceptionally large number of pedestrians",1
"LO1: 1.4 Establish the characteristics of high duty and high amenity","What category of footway is a route which has been surfaced specifically for decorative purposes?",https://d2ywuokkaz628s.cloudfront.net/training_course/175/submodules/n7LTH4VSyg3C7ulefTQGlIfGcruLM8V2mcANXcNR.jpg,https://d2ywuokkaz628s.cloudfront.net/training_course/175/submodules/n7LTH4VSyg3C7ulefTQGlIfGcruLM8V2mcANXcNR.jpg,n/a,"High duty","High amenity","High friction","High quality",2
"LO3: 3.1: Identify the characteristics of recognised footway and carriageway designs","What equipment should be used to cut a smooth and vertical edge on the surface of a flexible road?",https://d2ywuokkaz628s.cloudfront.net/training_course/175/submodules/n7LTH4VSyg3C7ulefTQGlIfGcruLM8V2mcANXcNR.jpg,https://d2ywuokkaz628s.cloudfront.net/training_course/175/submodules/n7LTH4VSyg3C7ulefTQGlIfGcruLM8V2mcANXcNR.jpg,n/a,"Road breaker","Road saw","Rock drill","Backhoe excavator",2
"LO3: 3.1: Identify the characteristics of recognised footway and carriageway designs","What equipment should be used to rough cut material in a rigid road surface?",https://d2ywuokkaz628s.cloudfront.net/training_course/175/submodules/n7LTH4VSyg3C7ulefTQGlIfGcruLM8V2mcANXcNR.jpg,https://d2ywuokkaz628s.cloudfront.net/training_course/175/submodules/n7LTH4VSyg3C7ulefTQGlIfGcruLM8V2mcANXcNR.jpg,n/a,"Insulated pick","Pinch bar","Road breaker",Moleplough,3
"LO3: 3.1: Identify the characteristics of recognised footway and carriageway designs","What would be the most appropriate piece of equipment to excavate within the precautionary area of a tree?",https://d2ywuokkaz628s.cloudfront.net/training_course/175/submodules/n7LTH4VSyg3C7ulefTQGlIfGcruLM8V2mcANXcNR.jpg,https://d2ywuokkaz628s.cloudfront.net/training_course/175/submodules/n7LTH4VSyg3C7ulefTQGlIfGcruLM8V2mcANXcNR.jpg,n/a,"Suction excavator","Water jet","360º mini excavator","Insulated hand tools",1
"LO3: 3.2: Identify the appropriate tools and equipment used to safely excavate in the highway","Which regulation places responsibility upon businesses and organisations to ensure that work equipment is constructed or adapted to be suitable for the purpose it is used or provided for?",https://d2ywuokkaz628s.cloudfront.net/training_course/175/submodules/n7LTH4VSyg3C7ulefTQGlIfGcruLM8V2mcANXcNR.jpg,https://d2ywuokkaz628s.cloudfront.net/training_course/175/submodules/n7LTH4VSyg3C7ulefTQGlIfGcruLM8V2mcANXcNR.jpg,n/a,"Provision and Use of Work Equipment Regulations (PUWER)","Lifting Operation and Lifting Equipment Regulations (LOLER)","The Personal Protective Equipment at Work Regulations","Control of Vibration at Work Regulations",1
"LO3: 3.2: Identify the appropriate tools and equipment used to safely excavate in the highway","Which document defines the specific service and calibration requirements of equipment?",https://d2ywuokkaz628s.cloudfront.net/training_course/175/submodules/n7LTH4VSyg3C7ulefTQGlIfGcruLM8V2mcANXcNR.jpg,https://d2ywuokkaz628s.cloudfront.net/training_course/175/submodules/n7LTH4VSyg3C7ulefTQGlIfGcruLM8V2mcANXcNR.jpg,n/a,"Method statement","Health and Safety Executive guidance document","Provision and Use of Work Equipment Regulations","Manufacturer's instructions",4
"LO3: 3.2: Identify the appropriate tools and equipment used to safely excavate in the highway","What document would define the requirements that equipment must meet to be considered fit for purpose for a specific task or activity?",https://d2ywuokkaz628s.cloudfront.net/training_course/175/submodules/n7LTH4VSyg3C7ulefTQGlIfGcruLM8V2mcANXcNR.jpg,https://d2ywuokkaz628s.cloudfront.net/training_course/175/submodules/n7LTH4VSyg3C7ulefTQGlIfGcruLM8V2mcANXcNR.jpg,n/a,"Method statement and Risk Assessments","Manufacturer's instructions","HSE guidance documents","Permit to dig",1
"LO3: 3.3: Define the appropriate specifications that should be referred to when excavating","Which document provides information relating to the reuse of excavated materials?",https://d2ywuokkaz628s.cloudfront.net/training_course/175/submodules/n7LTH4VSyg3C7ulefTQGlIfGcruLM8V2mcANXcNR.jpg,https://d2ywuokkaz628s.cloudfront.net/training_course/175/submodules/n7LTH4VSyg3C7ulefTQGlIfGcruLM8V2mcANXcNR.jpg,n/a,"Safety at Street Works and Road Works, Approved Code of Practice","Specification for the Reinstatement of Openings in the Highway/Roads","Health and Safety Guidance 47, Avoiding Danger from Underground Services","Specification for Highway Works, 'Series 1000'",2
"LO3: 3.3: Define the appropriate specifications that should be referred to when excavating","What is the purpose of HSG47?",https://d2ywuokkaz628s.cloudfront.net/training_course/175/submodules/n7LTH4VSyg3C7ulefTQGlIfGcruLM8V2mcANXcNR.jpg,https://d2ywuokkaz628s.cloudfront.net/training_course/175/submodules/n7LTH4VSyg3C7ulefTQGlIfGcruLM8V2mcANXcNR.jpg,n/a,"To provide guidance about the dangers of working near underground service","To provide guidance about the dangers of working in deep excavations","To provide guidance about the dangers of working near high speed roads","To provide guidance about the dangers of working on a construction site",1
"LO3: 3.3: Define the appropriate specifications that should be referred to when excavating","Which document defines the typical construction layers of roads and footways?",https://d2ywuokkaz628s.cloudfront.net/training_course/175/submodules/n7LTH4VSyg3C7ulefTQGlIfGcruLM8V2mcANXcNR.jpg,https://d2ywuokkaz628s.cloudfront.net/training_course/175/submodules/n7LTH4VSyg3C7ulefTQGlIfGcruLM8V2mcANXcNR.jpg,n/a,"Safety at Street Works and Road Works, Approved Code of Practice","Specification for the Reinstatement of Openings in the Highway/Roads","Health and Safety Guidance 47, Avoiding Danger from Underground Services","Specification for Highway Works 'Series 300'",2
"LO3: 3.4: Define the appropriate methods used to identify areas of high risk relating to excavation","How should areas of high danger relating to excavation activities identified?",https://d2ywuokkaz628s.cloudfront.net/training_course/175/submodules/n7LTH4VSyg3C7ulefTQGlIfGcruLM8V2mcANXcNR.jpg,https://d2ywuokkaz628s.cloudfront.net/training_course/175/submodules/n7LTH4VSyg3C7ulefTQGlIfGcruLM8V2mcANXcNR.jpg,n/a,"Completing a method statement","Attending regular tool box talks","Completing a risk assessment","Reading the relevant HSE guidance",3
"LO3: 3.4: Define the appropriate methods used to identify areas of high risk relating to excavation","Why must excavations be inspected by a competent person at the start of each shift and after any events such as the fall of rock or earth?",https://d2ywuokkaz628s.cloudfront.net/training_course/175/submodules/n7LTH4VSyg3C7ulefTQGlIfGcruLM8V2mcANXcNR.jpg,https://d2ywuokkaz628s.cloudfront.net/training_course/175/submodules/n7LTH4VSyg3C7ulefTQGlIfGcruLM8V2mcANXcNR.jpg,n/a,"To identify any areas of high risk that may lead to collapse","To complete job pack records at the request of the employer","To comply with health and safety legislation","To ensure that work within the excavation continues to progress",1
"LO3: 3.4: Define the appropriate methods used to identify areas of high risk relating to excavation","What is the purpose of conducting site specific risk assessments for excavation activities?",https://d2ywuokkaz628s.cloudfront.net/training_course/175/submodules/n7LTH4VSyg3C7ulefTQGlIfGcruLM8V2mcANXcNR.jpg,https://d2ywuokkaz628s.cloudfront.net/training_course/175/submodules/n7LTH4VSyg3C7ulefTQGlIfGcruLM8V2mcANXcNR.jpg,n/a,"To outline how the task is to be done safely","To identify risks and the appropriate control measures","To present health and safety topics to the workforce","To provide written authorisation for high risk activities",2
"LO3: 3.5: Identify the relevant control measures that should be in place when excavating","What safety measure should be in place to reduce the risks from traffic when excavating in the highway?",https://d2ywuokkaz628s.cloudfront.net/training_course/175/submodules/n7LTH4VSyg3C7ulefTQGlIfGcruLM8V2mcANXcNR.jpg,https://d2ywuokkaz628s.cloudfront.net/training_course/175/submodules/n7LTH4VSyg3C7ulefTQGlIfGcruLM8V2mcANXcNR.jpg,n/a,"High visibility clothing","Excavation covers","Enhanced fencing","Traffic control methods",4
"LO3: 3.5: Identify the relevant control measures that should be in place when excavating","What personal protective equipment (PPE) must be worn by operatives working outside of the working space in the highway?",https://d2ywuokkaz628s.cloudfront.net/training_course/175/submodules/n7LTH4VSyg3C7ulefTQGlIfGcruLM8V2mcANXcNR.jpg,https://d2ywuokkaz628s.cloudfront.net/training_course/175/submodules/n7LTH4VSyg3C7ulefTQGlIfGcruLM8V2mcANXcNR.jpg,n/a,"Water proof clothing","Protective gloves","High visibility clothing","Steel toe cap boots",3
"LO3: 3.5: Identify the relevant control measures that should be in place when excavating","What equipment should be used to maintain a route for pedestrians and provide light vehicles access to premises during excavation works in the footway?",https://d2ywuokkaz628s.cloudfront.net/training_course/175/submodules/n7LTH4VSyg3C7ulefTQGlIfGcruLM8V2mcANXcNR.jpg,https://d2ywuokkaz628s.cloudfront.net/training_course/175/submodules/n7LTH4VSyg3C7ulefTQGlIfGcruLM8V2mcANXcNR.jpg,n/a,"Trench cover","Road plates","Footway ramps","Footway boards",4
